{
  "contract_version": 1,
  "operation_id": "40000000-0000-4000-8000-000000000001",
  "alert_id": "30000000-0000-4000-8000-000000000001",
  "source_device_id": "30000000-0000-4000-8000-000000000003",
  "action": "SNOOZE",
  "occurred_at": "2026-09-01T14:00:00Z",
  "snooze_until": "2026-09-01T14:30:00Z"
}
